<?xml version="1.0" encoding="UTF-8"?>
<Reports xmlns:xsi="http://www.w3.org/2001/XMLSchema-instance"
	xsi:noNamespaceSchemaLocation="http://www.triggersolucoes.com/tears/1.0/Report.xsd" Version="1.0">
	<Report ConnectionId="jdbc/northwind" Id="OrdersByShipper"
		Description="Order by Shipper. Form to select shipper. The combo box is filled automatically. It also has a consolidator, counting the number of itens"
		>
		<ReportParameters>
			<ReportParameter Id="idShipper" Type="QUERY">
				<ReportParameterSql>
					<sql><![CDATA[
SELECT ShipperID AS "KEY" , CompanyName "VALUE" FROM Shippers
				]]></sql>
				</ReportParameterSql>
			</ReportParameter>
		</ReportParameters>
		<Recordset Id="OrdersByShipper" DefaultSortColumn="OrderID"
			Description="List of orders shipped by an specific shipper company"
			PageSize="17">
			<Sql><![CDATA[SELECT OrderID, CustomerID, EmployeeID, OrderDate, RequiredDate, 
ShippedDate, ShipVia, Freight, ShipName, ShipAddress, ShipCity, 
ShipRegion, ShipPostalCode, ShipCountry FROM Orders 
WHERE ShipVia= #{idShipper}
			]]></Sql>
			<Columns>
				<Column Consolidator="count" Id="OrderID" Type="TEXT"
					Description="Number of orders" />
				<Column Id="Freight" Type="DOUBLE" Format="#.##" />
			</Columns>
		</Recordset>
	</Report>
	<Report Id="OrdersByShipperFiltering"
		Description="Order by Shipper.">
		<Recordset Id="OrdersByShipperFiltering" DefaultSortColumn="OrderID"
			Description="List of orders shipped by an specific shipper company"
			PageSize="17">
			<Sql><![CDATA[SELECT OrderID, CustomerID, EmployeeID, OrderDate, RequiredDate, 
ShippedDate, ShipVia, Freight, ShipName, ShipAddress, ShipCity, 
ShipRegion, ShipPostalCode, ShipCountry FROM Orders 
			]]></Sql>
			<Columns>
				<Column Id="ShipVia" AllowFilter="true" />
				<Column Id="ShipCountry" AllowFilter="true" />
				<Column Id="OrderID" Display="false" />
				
			</Columns>
		</Recordset>
	</Report>
</Reports>