<?xml version="1.0" encoding="UTF-8"?>
<Reports xmlns:xsi="http://www.w3.org/2001/XMLSchema-instance"
	xsi:noNamespaceSchemaLocation="http://www.triggersolucoes.com/tears/1.0.1/Report.xsd" Version="1.0.1">
	<Report Id="BasicDrillDown" Description="One Column with link for details">
		<Recordset Id="BasicDrillDown" DefaultSortColumn="One Column with link for details"
			Description="Click on the id number to see Product list for the category">
			<Sql><![CDATA[SELECT CategoryID, CategoryName, Description
FROM Categories
			]]></Sql>
			<Columns>
				<Column Id="CatID" Description="Ver Detalhes" Type="TEXT" Value="Detalhes">
					<Url ReportId="ProductListByCategory"
						Description="Click here to see Product list for this category">
						<UrlParameter Name="categoryID">CategoryID</UrlParameter>
					</Url>
				</Column>
				<Column Id="CategoryName" Description="Name Category" />
				<Column Id="Description" Description="Description" />
			</Columns>
		</Recordset>

	</Report>
</Reports>