<?xml version="1.0" encoding="UTF-8"?>
<Reports xmlns:xsi="http://www.w3.org/2001/XMLSchema-instance"
	xsi:noNamespaceSchemaLocation="http://www.triggersolucoes.com/tears/1.0.1/Report.xsd" Version="1.0.1">
	<Report Id="ListadeCursos" Description="Lista de cursos">
		<ReportParameters>
			<ReportParameter Id="category" Description="Categoria" Type="QUERY" Required="true">
				<ReportParameterSql><sql><![CDATA[
SELECT id AS "KEY" , name "VALUE" FROM #{table.prefix}course_categories;
				]]></sql></ReportParameterSql>
			</ReportParameter>
		</ReportParameters>
		<Recordset Id="ListaDeCursos"
			Description="Lista de cursos">
			<Sql><![CDATA[
				SELECT c.id, c.shortname, c.fullname, c.idnumber, c.format, COUNT('') Alunos, c.visible
					FROM #{table.prefix}course c
					 INNER JOIN #{table.prefix}context cx ON c.id = cx.instanceid AND cx.contextlevel = '50'
					 INNER JOIN #{table.prefix}role_assignments ra ON cx.id = ra.contextid
					 INNER JOIN #{table.prefix}role r ON ra.roleid = r.id
					WHERE r.id = 5 and category= #{category}
					GROUP BY c.id; 
			]]></Sql>
			<Columns>
				<Column Id="id">
					<Url ReportId="ListadeQuestionarios" Description="Listar os questionários">
						<UrlParameter Name="course">id</UrlParameter>
					</Url>
					<Url ReportId="ListadeUsuarios" Description="Listar os usuários desse curso">
						<UrlParameter Name="course">id</UrlParameter>
					</Url>
					<Url ReportId="ForunsPorCurso" Description="Listar os fóruns desse curso">
						<UrlParameter Name="course">id</UrlParameter>
					</Url>
					<Url ReportId="ListadeDialogos" Description="Listar os dialogos desse curso">
						<UrlParameter Name="course">id</UrlParameter>
					</Url>					
				</Column>
				<Column Id="shortname" Description="Nome"/>
				<Column Id="fullname" Description="Descrição"/>
				<Column Id="visible" Description="Visível"
					MappedDataNotFound="Ainda não definido">
					<ColumnMap Key="1" MessageKey="Visível" />
					<ColumnMap Key="0" MessageKey="Oculto" />
				</Column>
				<Column Id="format" Description="Formato"/>
			</Columns>
		</Recordset>
	</Report>
	
</Reports>