<?xml version="1.0" encoding="UTF-8"?>
<Reports xmlns:xsi="http://www.w3.org/2001/XMLSchema-instance"
	xsi:noNamespaceSchemaLocation="http://www.triggersolucoes.com/tears/1.0/Report.xsd"
	Version="1.0">
	<Report Id="ProdutosPorCategoria" Description="Lista de produtos da categoria">
		<ReportParameters>
			<ReportParameter Id="categoryID" Type="QUERY">
				<ReportParameterSql>
					<sql><![CDATA[
					SELECT CategoryID "KEY", CategoryName "VALUE"
FROM Categories order by CategoryName
				]]></sql>
				</ReportParameterSql>
			</ReportParameter>
		</ReportParameters>
		<Recordset Id="ProdutosPorCategoria" Description="Lista de produtos da categoria">
			<Sql><![CDATA[SELECT DISTINCT Products.*, Categories.CategoryName
FROM Categories INNER JOIN Products ON Categories.CategoryID = Products.CategoryID
WHERE Categories.CategoryID = #{categoryID}
			]]></Sql>
			<Columns>
				<Column Id="ProductID" Type="INTEGER" StyleClass="COLORED_NUMBER" />
				<Column Id="SupplierID" Type="INTEGER" StyleClass="COLORED_NUMBER">
					<Url ReportId="DetalheFornecedor" OpenInLine="true"
						Description="Clique aqui para ver o detalhe dos fornecedores">
						<UrlParameter Name="supplierID">SupplierID</UrlParameter>
					</Url>
				</Column>
				<Column Id="Discontinued" Description="MappedColumn" Type="TEXT"
					MappedDataNotFound="Undefined">
					<ColumnMap Key="1" MessageKey="Active" />
					<ColumnMap Key="0" MessageKey="Discontinued" />
				</Column>
			</Columns>
		</Recordset>
	</Report>
	<Report Id="DetalheFornecedor" Description="Detalhes do Fornecedor"
		IsMainReport="false">
		<ReportParameters>
			<ReportParameter Id="supplierID" Required="true"
				Description="Supplier Id" Type="INTEGER" />
		</ReportParameters>
		<Recordset Id="DetalheFornecedor" Description="Detalhes do Fornecedor"
			AllowExport="none">
			<Sql><![CDATA[SELECT SupplierID, CompanyName, ContactName, ContactTitle
, Address, City, Region, PostalCode, Country, Phone, Fax, HomePage
FROM Suppliers 
WHERE SupplierID = #{supplierID}
			]]></Sql>
		</Recordset>
	</Report>
</Reports>