<?xml version="1.0" encoding="UTF-8"?>
<Reports xmlns:xsi="http://www.w3.org/2001/XMLSchema-instance"
xsi:noNamespaceSchemaLocation="http://www.triggersolucoes.com/tears/1.0.2/Report.xsd" Version="1.0">
	<Report Id="AutoFilter" Title="Auto filter"
		Description="This report has two columns defined as Autofilter. See configuration file to detail">
		<Recordset Id="AutoFilter" Title="Auto filter" DefaultSortColumn="OrderID"
			Description="This report has two columns defined as Autofilter. See configuration file to detail"
			PageSize="17" AllowExport="none">
			<Sql><![CDATA[SELECT OrderID, CustomerID, EmployeeID, OrderDate, RequiredDate, 
ShippedDate, ShipVia, Freight, ShipName, ShipAddress, ShipCity, 
ShipRegion, ShipPostalCode, ShipCountry FROM Orders 
			]]></Sql>
			<Columns>
				<Column Id="ShipVia" AllowFilter="true" />
				<Column Id="ShipCountry" AllowFilter="true" />
				<Column Id="OrderID" Display="false" />				
			</Columns>
		</Recordset>
	</Report>
</Reports>