<?xml version="1.0" encoding="UTF-8"?>
<Reports xmlns:xsi="http://www.w3.org/2001/XMLSchema-instance"
	xsi:noNamespaceSchemaLocation="http://www.triggersolucoes.com/tears/1.0.1/Report.xsd" Version="1.0.1">
	<Report Id="ListadeCategorias" Description="Lista de categorias">
		<Recordset Id="ListaDeCategorias"
			Description="Lista de categoria dos cursos">
			<Sql><![CDATA[
				select id, name, description, coursecount, visible from #{table.prefix}course_categories;
			]]></Sql>
			<Columns>
				<Column Id="id">
					<Url ReportId="ListadeCursos" Description="Clique aqui para listar os cursos dessa categoria">
						<UrlParameter Name="category">id</UrlParameter>
					</Url>
				</Column>
				<Column Id="visible" Description="Visível"
					MappedDataNotFound="Ainda não definido">
					<ColumnMap Key="1" MessageKey="Visível" />
					<ColumnMap Key="0" MessageKey="Oculto" />
				</Column>
				<Column Id="name" Description="Nome"/>
				<Column Id="description" Description="Descrição"/>
				<Column Id="coursecount" Description="Qte de Cursos" Type="INTEGER"/>
			</Columns>
		</Recordset>
	</Report>
</Reports>