<?xml version="1.0" encoding="UTF-8"?>
<Reports xmlns:xsi="http://www.w3.org/2001/XMLSchema-instance"
	xsi:noNamespaceSchemaLocation="http://www.triggersolucoes.com/tears/1.0/Report.xsd"
	Version="1.0">
	<Report Id="RedirectsDiaProvider" Description="Redirects por dia por Provider">
		<ReportParameters>
			<ReportParameter Id="idProvider" Type="QUERY"
				Description="Selecione o Provider">
				<ReportParameterSql>
					<sql><![CDATA[
SELECT id AS "KEY" , nome "VALUE" FROM site
				]]></sql>
				</ReportParameterSql>
			</ReportParameter>
		</ReportParameters>
		<Recordset Id="RedirectsDiaProvider" Description="Redirects por dia por Provider" Display="false">
			<Sql><![CDATA[select data, count(*) Total
from redirect r
where siteid = #{idProvider}
group by data
]]></Sql>
			<Columns>
				<Column Id="data" Description="Data" Type="DATE" />
				<Column Id="Count" Type="TEXT" Value="Detalhes"/>
			</Columns>
			<Chart Type="MotionChart">
				<ChartColumn RefId="Count" />
				<ChartColumn RefId="data" />
				<ChartColumn RefId="Total" />
			</Chart>

	
		</Recordset>
	</Report>

</Reports>