<?xml version="1.0" encoding="UTF-8"?>
<Reports xmlns:xsi="http://www.w3.org/2001/XMLSchema-instance"
	xsi:noNamespaceSchemaLocation="http://www.triggersolucoes.com/tears/1.0.1/Report.xsd"
	Version="1.0.1">
	<Report Id="Categorias" Description="Lista de Categorias de Produtos">
		<Recordset Id="Categorias" Description="Lista de Categorias de Produtos">
			<Sql><![CDATA[SELECT CategoryID, CategoryName, Description
FROM Categories
			]]></Sql>
			<Columns>
				<Column Id="CategoryID" Description="Id" Type="INTEGER">
					<Url ReportId="ProdutosPorCategoria"
						Description="Clique aqui para ver a lista de produtos dessa categoria">
						<UrlParameter Name="categoryID">CategoryID</UrlParameter>
					</Url>
				</Column>
				<Column Id="CategoryName" Description="Nome Categoria" />
				<Column Id="Description" Description="Descrição" />
			</Columns>
		</Recordset>

	</Report>
</Reports>