<?xml version="1.0" encoding="UTF-8"?>
<Reports xmlns:xsi="http://www.w3.org/2001/XMLSchema-instance"
	xsi:noNamespaceSchemaLocation="http://www.triggersolucoes.com/tears/1.0/Report.xsd" Version="1.0">
	<Report Id="StyleExpression" Description="Alphabetical List of Category" >
		<Recordset Id="StyleExpression" DefaultSortColumn="CategoryName"
			Description="Simple SQL with explicit columns definitions. It also has a URL to another report">
			<Sql><![CDATA[SELECT CategoryID, CategoryName, Description
FROM Categories
			]]></Sql>
			<Columns>
				<Column Id="CategoryID" Description="Id" Type="DOUBLE" Format="##.00">
					<Url ReportId="ProductListByCategory"
						Description="Click here to see Product list for this category">
						<UrlParameter Name="categoryID">CategoryID</UrlParameter>
					</Url>
				</Column>
				<Column Id="CategoryID" StyleExpression="(CategoryID % 2 == 0? 'background-red':'background-green')">
				</Column>
				<Column Id="DoubleId" Expression="(CategoryID * CategoryID)" StyleExpression="(CategoryID % 2 == 0? 'font-red ':'font-green ')">
				</Column>
				<Column Id="SumColumn" Value="test" StyleExpression="((DoubleId + CategoryID) > 14? 'font-yellow bold':'font-red italic')">
				</Column>
				<Column Id="TreeColors" Expression="(CategoryID)" StyleExpression="((CategoryID * 2) % 3 == 0? 'background-red font-green':((CategoryID * 2) % 3 == 1?'background-green font-yellow':'background-yellow font-red'))">
				</Column>
			</Columns>
		</Recordset>
	</Report>
</Reports>